{
  "$schema": "public-content-v1.schema.json",
  "schema_version": "1.0",
  "contract_id": "euvics-public-content-v1",
  "repository": {
    "url": "https://github.com/chongshikpark/euvics",
    "source_commit_policy": "locked-by-consuming-website"
  },
  "default_policy": "excluded",
  "allowlist": [
    {
      "path": "cdr/sections/introduction.tex",
      "kind": "latex-source",
      "title": "EUVICS project introduction and source concept",
      "version": "physics-overview-v1",
      "publication_status": "public-draft",
      "approval": {
        "status": "approved",
        "approved_by": "Chong Shik Park, Ph.D. — project owner and scientific reviewer",
        "approved_on": "2026-08-03"
      },
      "license": "MIT License",
      "attribution": "Copyright (c) 2026 Chong Shik Park, Ph.D.; EUVICS project",
      "known_limitations": [
        "Project aims and candidate cases are not demonstrated source performance.",
        "Application requirements and verification criteria remain unapproved."
      ]
    },
    {
      "path": "cdr/sections/source_overview.tex",
      "kind": "latex-source",
      "title": "EUVICS inverse Compton scattering physics overview",
      "version": "physics-overview-v1",
      "publication_status": "public-draft",
      "approval": {
        "status": "approved",
        "approved_by": "Chong Shik Park, Ph.D. — project owner and scientific reviewer",
        "approved_on": "2026-08-03"
      },
      "license": "MIT License",
      "attribution": "Copyright (c) 2026 Chong Shik Park, Ph.D.; EUVICS project",
      "known_limitations": [
        "The documented pyEUVICS yield and spectrum models include stated approximations and are not facility validation.",
        "The 6.7 nm CAIN comparison has incomplete provenance and remains a known disagreement; no empirical correction is justified.",
        "The 13.5 nm case remains provisional, and synthetic detector calibration is workflow evidence rather than measured calibration.",
        "Subsystem design values and allocations remain TBD."
      ]
    },
    {
      "path": "bibliography/references.bib",
      "kind": "bibliography",
      "title": "EUVICS verified bibliography",
      "version": "physics-overview-v1",
      "publication_status": "public-draft",
      "approval": {
        "status": "approved",
        "approved_by": "Chong Shik Park, Ph.D. — project owner and scientific reviewer",
        "approved_on": "2026-08-03"
      },
      "license": "MIT License",
      "attribution": "Copyright (c) 2026 Chong Shik Park, Ph.D.; EUVICS project; individual references retain their cited authorship and publication metadata",
      "known_limitations": [
        "The bibliography includes contextual subsystem sources beyond the records used by the public physics overview.",
        "Cited performance from other facilities is not assigned to EUVICS."
      ]
    }
  ],
  "exclusions": [
    {
      "path_prefix": "archive/",
      "category": "historical-archive",
      "reason": "Historical source material and PDFs are retained for internal reference, not public release."
    },
    {
      "path_prefix": "papers/",
      "category": "historical-working-copy",
      "reason": "Imported working copies are not authoritative release artifacts."
    },
    {
      "path_prefix": "reviews/",
      "category": "internal-review",
      "reason": "Review registers, open decisions, and missing-evidence records are internal working material."
    },
    {
      "path_prefix": "docs/exec-plans/",
      "category": "internal-planning",
      "reason": "Execution plans are not website publication content."
    },
    {
      "path_prefix": "docs/document_writing_milestones_20260727/",
      "category": "internal-planning",
      "reason": "Historical milestone planning is not website publication content."
    },
    {
      "path_prefix": "proposal/sections/cost_estimate.tex",
      "category": "confidential-or-unapproved-cost",
      "reason": "Cost material requires responsible-owner approval before public release."
    },
    {
      "path_prefix": "cdr/sections/cost_estimate.tex",
      "category": "confidential-or-unapproved-cost",
      "reason": "Cost material requires responsible-owner approval before public release."
    },
    {
      "path_prefix": "archive/original_20260727/img/ics-layout.png",
      "category": "restricted-figure",
      "reason": "Authorship and distribution permission are unresolved in figures/permissions.md."
    }
  ],
  "publication_decisions": [
    {
      "subject": "Proposal PDF",
      "status": "approval-pending",
      "owner": "project-owner",
      "decision_needed": "Resolve or accept the documented TBD material, then record the exact built PDF version, release date, public license, attribution, known limitations, approver, approval date, and checksum."
    },
    {
      "subject": "Conceptual Design Report PDF",
      "status": "blocked-permission",
      "owner": "project-owner",
      "decision_needed": "Complete the currently heading-only technical sections; resolve distribution permission for the page-2 layout figure or approve a replacement; then record the exact built PDF version, release date, public license, attribution, known limitations, approver, approval date, and checksum."
    }
  ]
}
